{
  "matrixId": "wcag-2.2-aa-matrix",
  "version": "2.1.0",
  "status": "ACTIVE_AUTHORITY",
  "target": "WCAG 2.2 Level AA: complete inventory of every Level A and AA success criterion",
  "normativeSource": "https://www.w3.org/TR/WCAG22/",
  "conformancePolicy": "Level AA requires all Level A and Level AA success criteria; NOT_APPLICABLE is an implementation-scope classification with an individual justification and reclassification trigger, not an exclusion from WCAG conformance.",
  "criterionCount": 55,
  "applicableCount": 43,
  "notApplicableCount": 12,
  "criteria": [
    {
      "successCriterion": "1.1.1",
      "level": "A",
      "name": "Non-text Content",
      "applicability": "APPLICABLE",
      "components": [
        "charts",
        "icons",
        "status graphics and evidence links"
      ],
      "risk": "meaning is unavailable to screen-reader users",
      "oracle": "every informative non-text item has an equivalent accessible name/description; decorative items are hidden",
      "testMethod": "axe/Playwright accessibility tree plus manual chart alternative review",
      "automationPossible": true,
      "manualTestRequired": true,
      "fixtureRef": "specs/001-fundamental-analysis-platform/fixtures/accessibility/wcag-oracle-inventory.json#/oracles/SC-1-1-1",
      "releaseBlocking": true,
      "acceptanceCriterionIds": [
        "AC-074"
      ]
    },
    {
      "successCriterion": "1.2.1",
      "level": "A",
      "name": "Audio-only and Video-only (Prerecorded)",
      "applicability": "NOT_APPLICABLE",
      "components": [
        "product scope and feature inventory"
      ],
      "risk": "an untracked feature could invalidate the documented non-applicability decision",
      "oracle": "the excluded content or interaction is absent from every release scope item",
      "testMethod": "manual scope and feature inventory review before release",
      "automationPossible": false,
      "manualTestRequired": true,
      "fixtureRef": "specs/001-fundamental-analysis-platform/fixtures/accessibility/wcag-oracle-inventory.json#/oracles/SC-1-2-1",
      "releaseBlocking": true,
      "notApplicableJustification": "The MVP contains no prerecorded audio-only or video-only media.",
      "reclassificationTrigger": "any feature introducing content or interaction covered by this success criterion",
      "acceptanceCriterionIds": [
        "AC-077"
      ]
    },
    {
      "successCriterion": "1.2.2",
      "level": "A",
      "name": "Captions (Prerecorded)",
      "applicability": "NOT_APPLICABLE",
      "components": [
        "product scope and feature inventory"
      ],
      "risk": "an untracked feature could invalidate the documented non-applicability decision",
      "oracle": "the excluded content or interaction is absent from every release scope item",
      "testMethod": "manual scope and feature inventory review before release",
      "automationPossible": false,
      "manualTestRequired": true,
      "fixtureRef": "specs/001-fundamental-analysis-platform/fixtures/accessibility/wcag-oracle-inventory.json#/oracles/SC-1-2-2",
      "releaseBlocking": true,
      "notApplicableJustification": "The MVP contains no prerecorded synchronized media requiring captions.",
      "reclassificationTrigger": "any feature introducing content or interaction covered by this success criterion",
      "acceptanceCriterionIds": [
        "AC-077"
      ]
    },
    {
      "successCriterion": "1.2.3",
      "level": "A",
      "name": "Audio Description or Media Alternative (Prerecorded)",
      "applicability": "NOT_APPLICABLE",
      "components": [
        "product scope and feature inventory"
      ],
      "risk": "an untracked feature could invalidate the documented non-applicability decision",
      "oracle": "the excluded content or interaction is absent from every release scope item",
      "testMethod": "manual scope and feature inventory review before release",
      "automationPossible": false,
      "manualTestRequired": true,
      "fixtureRef": "specs/001-fundamental-analysis-platform/fixtures/accessibility/wcag-oracle-inventory.json#/oracles/SC-1-2-3",
      "releaseBlocking": true,
      "notApplicableJustification": "The MVP contains no prerecorded synchronized media requiring audio description or a media alternative.",
      "reclassificationTrigger": "any feature introducing content or interaction covered by this success criterion",
      "acceptanceCriterionIds": [
        "AC-077"
      ]
    },
    {
      "successCriterion": "1.2.4",
      "level": "AA",
      "name": "Captions (Live)",
      "applicability": "NOT_APPLICABLE",
      "components": [
        "product scope and feature inventory"
      ],
      "risk": "an untracked feature could invalidate the documented non-applicability decision",
      "oracle": "the excluded content or interaction is absent from every release scope item",
      "testMethod": "manual scope and feature inventory review before release",
      "automationPossible": false,
      "manualTestRequired": true,
      "fixtureRef": "specs/001-fundamental-analysis-platform/fixtures/accessibility/wcag-oracle-inventory.json#/oracles/SC-1-2-4",
      "releaseBlocking": true,
      "notApplicableJustification": "The MVP contains no live synchronized media.",
      "reclassificationTrigger": "any feature introducing content or interaction covered by this success criterion",
      "acceptanceCriterionIds": [
        "AC-077"
      ]
    },
    {
      "successCriterion": "1.2.5",
      "level": "AA",
      "name": "Audio Description (Prerecorded)",
      "applicability": "NOT_APPLICABLE",
      "components": [
        "product scope and feature inventory"
      ],
      "risk": "an untracked feature could invalidate the documented non-applicability decision",
      "oracle": "the excluded content or interaction is absent from every release scope item",
      "testMethod": "manual scope and feature inventory review before release",
      "automationPossible": false,
      "manualTestRequired": true,
      "fixtureRef": "specs/001-fundamental-analysis-platform/fixtures/accessibility/wcag-oracle-inventory.json#/oracles/SC-1-2-5",
      "releaseBlocking": true,
      "notApplicableJustification": "The MVP contains no prerecorded video requiring audio description.",
      "reclassificationTrigger": "any feature introducing content or interaction covered by this success criterion",
      "acceptanceCriterionIds": [
        "AC-077"
      ]
    },
    {
      "successCriterion": "1.3.1",
      "level": "A",
      "name": "Info and Relationships",
      "applicability": "APPLICABLE",
      "components": [
        "application shell",
        "analysis views",
        "dialogs",
        "forms and status regions"
      ],
      "risk": "failure of 1.3.1 Info and Relationships prevents equivalent or predictable operation",
      "oracle": "all in-scope UI states satisfy WCAG 2.2 success criterion 1.3.1 (Info and Relationships) without relying on an undocumented exception",
      "testMethod": "Playwright and accessibility-tree assertions where automatable, plus criterion-specific manual review",
      "automationPossible": true,
      "manualTestRequired": true,
      "fixtureRef": "specs/001-fundamental-analysis-platform/fixtures/accessibility/wcag-oracle-inventory.json#/oracles/SC-1-3-1",
      "releaseBlocking": true,
      "acceptanceCriterionIds": [
        "AC-074"
      ]
    },
    {
      "successCriterion": "1.3.2",
      "level": "A",
      "name": "Meaningful Sequence",
      "applicability": "APPLICABLE",
      "components": [
        "application shell",
        "analysis views",
        "dialogs",
        "forms and status regions"
      ],
      "risk": "failure of 1.3.2 Meaningful Sequence prevents equivalent or predictable operation",
      "oracle": "all in-scope UI states satisfy WCAG 2.2 success criterion 1.3.2 (Meaningful Sequence) without relying on an undocumented exception",
      "testMethod": "Playwright and accessibility-tree assertions where automatable, plus criterion-specific manual review",
      "automationPossible": true,
      "manualTestRequired": true,
      "fixtureRef": "specs/001-fundamental-analysis-platform/fixtures/accessibility/wcag-oracle-inventory.json#/oracles/SC-1-3-2",
      "releaseBlocking": true,
      "acceptanceCriterionIds": [
        "AC-074"
      ]
    },
    {
      "successCriterion": "1.3.3",
      "level": "A",
      "name": "Sensory Characteristics",
      "applicability": "APPLICABLE",
      "components": [
        "application shell",
        "analysis views",
        "dialogs",
        "forms and status regions"
      ],
      "risk": "failure of 1.3.3 Sensory Characteristics prevents equivalent or predictable operation",
      "oracle": "all in-scope UI states satisfy WCAG 2.2 success criterion 1.3.3 (Sensory Characteristics) without relying on an undocumented exception",
      "testMethod": "Playwright and accessibility-tree assertions where automatable, plus criterion-specific manual review",
      "automationPossible": true,
      "manualTestRequired": true,
      "fixtureRef": "specs/001-fundamental-analysis-platform/fixtures/accessibility/wcag-oracle-inventory.json#/oracles/SC-1-3-3",
      "releaseBlocking": true,
      "acceptanceCriterionIds": [
        "AC-074"
      ]
    },
    {
      "successCriterion": "1.3.4",
      "level": "AA",
      "name": "Orientation",
      "applicability": "APPLICABLE",
      "components": [
        "application shell",
        "analysis views",
        "dialogs",
        "forms and status regions"
      ],
      "risk": "failure of 1.3.4 Orientation prevents equivalent or predictable operation",
      "oracle": "all in-scope UI states satisfy WCAG 2.2 success criterion 1.3.4 (Orientation) without relying on an undocumented exception",